{
  "title": "QR team with role divide",
  "description": "Verdeel studenten via QR in teams en laat ze per ronde een andere rol aannemen in een praktijksimulatie.",
  "teamSize": {
    "min": 3,
    "max": 4
  },
  "roundsMode": "all-roles-once",
  "roleTimeoutSeconds": 180,
  "shuffleWaitSeconds": 30,
  "enableTestUsers": true,
  "teamNames": [
    "Team Kompas",
    "Team Horizon",
    "Team Atlas",
    "Team Nova"
  ],
  "teamColors": [
    "yellow",
    "green",
    "purple",
    "orange"
  ],
  "otherRoleName": "Overig",
  "otherRoleInstructions": [
    "Je ondersteunt je team, noteert de belangrijkste argumenten en bewaakt dat iedereen aan bod komt.",
    "Je helpt bij het concretiseren van ideeën en verzamelt voorbeelden die de rest van het team kan gebruiken."
  ],
  "roles": [
    {
      "name": "Klant",
      "countPerTeam": 1,
      "instructions": [
        "Je bent klant en eigenaar van een vuilophaaldienst. Je wilt op een slimme manier weten hoe vol je containers zijn zodat routes efficiënter worden.",
        "Je bent klant en beheert meerdere schoollocaties. Je zoekt een oplossing om per locatie beter inzicht te krijgen in afvalstromen en onderhoud."
      ],
      "audioRecording": false,
      "videoRecording": false,
      "alternativeInstruction": ""
    },
    {
      "name": "Analist",
      "countPerTeam": 1,
      "instructions": [
        "Je analyseert het probleem van de klant en vertaalt losse wensen naar concrete, meetbare behoeften.",
        "Je onderzoekt welke gegevens en processen nodig zijn om de klantvraag scherp te krijgen en te prioriteren."
      ],
      "audioRecording": false,
      "videoRecording": false,
      "alternativeInstruction": ""
    },
    {
      "name": "Pitcher",
      "countPerTeam": 1,
      "instructions": [
        "Je bereidt een korte pitch van maximaal 30 seconden voor waarin je team het slimste voorstel samenvat.",
        "Je vat de beste oplossing samen in een korte pitch en benoemt waarom dit voorstel waarde oplevert voor de klant."
      ],
      "audioRecording": true,
      "videoRecording": false,
      "alternativeInstruction": "Als opname niet mag, schrijf je samen met je team een pitch van vijf zinnen en lever je die mondeling in bij de docent."
    }
  ]
}
